{
  "contract_version": "0.3.0",
  "scenario_id": "teesta__s007",
  "dam_id": "south_lhonak",
  "method": "breach_growth_weir",
  "params": {
    "breach_width_m": 129.7,
    "failure_time_s": 6916.66,
    "water_volume_m3": 50000000.0
  },
  "dt_s": 60.0,
  "t_offset_s": 0.0,
  "peak_q_m3s": 12049.45651630535,
  "time_to_peak_s": 6894.7313752173895,
  "volume_m3": 49948496.43317634,
  "mass_balance_error_pct": -0.0030101437911137685,
  "peak_within_m2_range": null,
  "has_placeholders": true,
  "caveats": [
    {
      "id": "storage_from_area_volume_relation",
      "severity": "info",
      "text_key": "caveat_storage_from_area_volume_relation"
    },
    {
      "id": "hydrograph_did_not_fully_drain",
      "severity": "warning",
      "text_key": "caveat_hydrograph_did_not_fully_drain"
    },
    {
      "id": "m2_qp_range_blocked",
      "severity": "info",
      "text_key": "caveat_m2_qp_range_blocked"
    },
    {
      "id": "clear_water",
      "severity": "info",
      "text_key": "caveat_clear_water"
    },
    {
      "id": "moraine_extrapolation",
      "severity": "info",
      "text_key": "caveat_moraine_extrapolation"
    }
  ],
  "provenance": {
    "method": "empirical",
    "code_version": "e60ffd1",
    "data_sources": [
      "docs/Equations.md",
      "docs/decisions.md"
    ]
  }
}
